{
  "cookie_policy": {
    "effective_date": "2026-04-22",
    "controller_contact_email": "privacy@roborock.us",
    "categories": [
      {
        "id": "strictly_necessary",
        "label": "Strictly necessary",
        "purpose": "Required for the site to function: maintaining your shopping cart, keeping you signed in, and protecting against cross-site request forgery. These cannot be disabled.",
        "default_state": "granted",
        "examples": ["session_id", "csrf_token", "cart_v1"],
        "retention_days": 30
      },
      {
        "id": "functional",
        "label": "Functional",
        "purpose": "Remember your preferences across visits — currency, language, saved wishlist, last-viewed product. Disabling these still lets you shop, but the site forgets your preferences each visit.",
        "default_state": "granted",
        "examples": ["roborock_wishlist_v2", "currency_pref"],
        "retention_days": 365
      },
      {
        "id": "analytics",
        "label": "Analytics",
        "purpose": "Help us understand which pages and products people use, so we can fix what is broken and build what is missing. We use Google Analytics 4 with IP anonymization. No raw IP is stored.",
        "default_state": "denied",
        "examples": ["_ga", "_ga_*", "_gid"],
        "retention_days": 730
      },
      {
        "id": "marketing",
        "label": "Marketing",
        "purpose": "Show you Roborock ads on Meta, TikTok, and Google after you have visited our site. We share hashed (SHA-256) email and phone with these networks for matching — never the raw values.",
        "default_state": "denied",
        "examples": ["_fbp", "_ttp", "_gcl_au"],
        "retention_days": 365
      },
      {
        "id": "personalization",
        "label": "Personalization",
        "purpose": "Tailor the homepage hero and product recommendations to what you have looked at. Disabling these means you see the default catalog ordering.",
        "default_state": "denied",
        "examples": ["reco_seed", "ab_variant"],
        "retention_days": 90
      }
    ],
    "body_md": "# Cookie Policy\n\n**Effective: 2026-04-22.**\n\nThis Cookie Policy explains how Roborock Inc. (\"Roborock\", \"we\", \"us\") uses cookies and similar tracking technologies on roborock.us. It complements our [Privacy Notice](/pages/privacy).\n\n## What is a cookie?\n\nA cookie is a small text file your browser stores when you visit a website. It lets the site remember things about you — that you are signed in, that your cart has 2 items, that your preferred language is English.\n\n## How we use cookies\n\nWe group cookies into 5 categories. **Strictly necessary** and **functional** cookies are on by default — without them the site cannot function or forgets your preferences each visit. **Analytics**, **marketing**, and **personalization** cookies are **off by default** and only turn on if you opt in via the cookie banner that appears on your first visit.\n\nYou can change your choices any time using the **Cookie Settings** link in the footer of every page.\n\n## Third parties we share with\n\nWhen you opt in to analytics or marketing cookies, the following third parties may receive data:\n\n| Provider | Purpose | Privacy policy |\n|---|---|---|\n| Google (Analytics + Ads) | Site analytics + advertising attribution | https://policies.google.com/privacy |\n| Meta (Facebook + Instagram) | Advertising attribution + retargeting | https://www.facebook.com/policy.php |\n| TikTok | Advertising attribution + retargeting | https://www.tiktok.com/legal/privacy-policy |\n| Stripe | Payment processing (always on, strictly necessary) | https://stripe.com/privacy |\n\nFor marketing cookies, any email address or phone number we share is hashed with SHA-256 before transmission. The networks cannot reverse the hash to recover your raw email or phone.\n\n## Retention\n\nEach category lists a retention period above. After that period, the cookie expires automatically. You can also clear cookies any time via your browser settings.\n\n## Contact\n\nQuestions? Email **privacy@roborock.us** and we respond within 7 business days."
  },
  "accessibility_statement": {
    "wcag_level": "AA",
    "wcag_version": "2.2",
    "axe_score": {
      "pass": 142,
      "violations": 3,
      "measured_at": "2026-04-15"
    },
    "conformance_status": "partial",
    "known_issues": [
      {
        "description": "Cookie consent banner color contrast on hover state falls below 4.5:1 against the brand-secondary background — affects WCAG 1.4.3.",
        "remediation_eta": "2026-05-30"
      },
      {
        "description": "Product gallery thumbnails lack visible focus indicator when tabbed in Safari 17 — affects WCAG 2.4.7.",
        "remediation_eta": "2026-05-15"
      },
      {
        "description": "Footer newsletter form input does not announce error state to NVDA screen reader on submit failure — affects WCAG 4.1.3.",
        "remediation_eta": "2026-06-15"
      }
    ],
    "contact_email": "accessibility@roborock.us",
    "body_md": "# Accessibility Statement\n\nRoborock is committed to making roborock.us usable by everyone, including people with disabilities. We aim to conform to the **Web Content Accessibility Guidelines (WCAG) 2.2 at Level AA**.\n\n## Current status: partial conformance\n\nLast tested **2026-04-15** using axe-core automated scanning, manual keyboard navigation, and spot checks with NVDA (Windows) and VoiceOver (macOS).\n\n- ✅ 142 automated checks pass\n- ⚠️ 3 violations identified (listed below with remediation dates)\n\n## Known issues and fix dates\n\n1. **Cookie banner contrast on hover** — color contrast falls below 4.5:1 in the hover state. Fix scheduled by **2026-05-30**.\n2. **Gallery focus indicator in Safari** — the visible focus ring disappears for product thumbnail buttons when tabbed in Safari 17. Fix scheduled by **2026-05-15**.\n3. **Newsletter form error announcement** — NVDA does not announce \"invalid email\" when the footer form is submitted with a malformed address. Fix scheduled by **2026-06-15**.\n\n## How we test\n\n- Automated: `axe-core` runs in CI on every pull request affecting components.\n- Manual: keyboard-only navigation across all 21 routes monthly.\n- Assistive tech: NVDA + VoiceOver spot-checks on cart, checkout, and PDP routes quarterly.\n\n## Need help right now?\n\nIf you encounter a barrier and need assistance completing a purchase, return, or warranty claim, email **accessibility@roborock.us** or call our support line. We respond within **5 business days** and can take orders by phone or email if the site is not working for you.\n\n## Alternative formats\n\nProduct manuals are available in large-print PDF and audio narration on request. Email accessibility@roborock.us with the SKU and your preferred format.\n\n## Standards reference\n\nThis statement is prepared in accordance with the W3C Accessibility Conformance Reporting (WCAG-EM) and the U.S. Department of Justice's interpretive guidance on web accessibility under the Americans with Disabilities Act (ADA)."
  },
  "ccpa_disclosure": {
    "effective_date": "2026-04-22",
    "do_not_sell_link": {
      "route_path": "/pages/ccpa-do-not-sell",
      "header_label": "Do Not Sell My Info",
      "footer_label": "Do Not Sell My Info"
    },
    "categories_collected": [
      "Identifiers (name, email, shipping address, IP address)",
      "Commercial information (order history, products viewed)",
      "Internet or other electronic network activity (browsing on roborock.us, search terms)",
      "Geolocation data (approximate location derived from IP, for shipping estimates)",
      "Inferences (product affinity, household type — derived from purchase + browse data)"
    ],
    "third_parties_shared": [
      { "name": "Google", "purpose": "Analytics (GA4) and advertising (Google Ads). Email/phone hashed with SHA-256." },
      { "name": "Meta", "purpose": "Advertising attribution and retargeting on Facebook + Instagram. Email/phone hashed." },
      { "name": "TikTok", "purpose": "Advertising attribution and retargeting on TikTok. Email/phone hashed." },
      { "name": "Stripe", "purpose": "Payment processing. Receives card data (which we never store) plus name + billing address." },
      { "name": "Shippo", "purpose": "Carrier rate quoting and label generation. Receives name, shipping address, package dimensions." }
    ],
    "request_form_email": "privacy@roborock.us",